subject,school,grade,code,content,text_1,text_2,text_3,text_4,text_5,text_6,text_7,text_8,text_9,text_10,text_11,text_12,text_13,text_14,text_15,text_16,text_17,text_18,text_19,text_20,text_21,text_22,text_23,text_24,text_25,text_26,text_27,text_28,text_29,text_30,text_31,text_32,text_33,text_34,text_35,text_36,text_37,text_38,text_39,text_40,text_41,text_42,text_43,text_44,text_45,text_46,text_47,text_48,text_49,text_50,text_51,text_52,text_53,text_54,text_55,text_56,text_57,text_58,text_59,text_60,text_61,text_62,text_63,text_64,text_65,text_66,text_67,text_68,text_69,text_70,text_71,text_72,text_73,text_74,text_75,text_76,text_77,text_78,text_79,text_80
영어,고등학교,1학년,10공영1-01-01,말이나 글에 포함된 세부 정보를 파악한다.,나는 그저 복슬복슬한 좋은 친구를 갖는 것에 마음에 끌렸는데. I was so drawn to just the idea of having a good furry friend.,"Chidi thought to himself, flapping his heart-shaped ears, which resembled his mother's. Chidi는 엄마의 귀를 닮은 하트 모양의 귀를 펄럭이며 혼자 생각했다.",The ants that live on the acacia trees keep the tree safe from other animals such as giraffes and elephants. 아까시나무에 사는 개미들이 기린과 코끼리 같은 동물들로부터 나무들을 보호해.,An Elephant's Life,Spotted hyenas eat the bones of other animals.,Dalia 이모가 자신의 커다란 코로 Chidi의 뒷다리 위쪽을 부드럽게 감싸면서 물었다. Aunt Dalia asked as she gently wrapped her tremendous trunk over Chidi's back leg.,Usually fish personality is divided by how shy or brave they are. 대개 물고기들은 얼마나 수줍어하는지 또는 용감한지로 성격이 구분 되지.,"그는 Bisa 할머니가 그리워졌다. 그분은 돌아가시기 전 그의 가족의 가장이었다. He missed Grandma Bisa, who was the head of his family before she passed away.",that makes sense 말이 되다,deafen 귀청을 터지게 하다 (to make someone temporarily unable to hear),nudge 살살 밀다 (push someone gently),tremendous 거대한 (very great in amount or level),"네 말이 맞아, 조언해줘서 고마워. You're right, thanks for the advice.",Have you heard the news on the recent discovery about crocodiles? 악어에 관한 최근 발견 뉴스를 들었니?,"For example, ladybugs protect our crops from other insects. 예를 들면, 무당벌레들은 우리의 농작물들을 다른 곤충들로부터 보호해줘.",Fayola was in a dangerous spot in the middle of the river. Fayola는 강 한가운데 있는 위험한 곳에 있었다.,Chidi's mom swiftly went into the water and put her trunk in the water and blew large bubbles so that Fayola could be gently nudged to the edge of the water. Chidi의 엄마가 재빨리 물속으로 들어가 코를 물속에 집어넣고 커다란 거품을 불어 Fayola를 물 가장자리로 부드럽게 밀어냈다.,flapping 이하는 동시 동작을 나타내는 분사구문으로 '~하면서'로 해석한다.,길을 잃은 한 노파였다. It was an old human lady who was lost.,sniff (코를 킁킁거리며) 냄새를 맡다 (to smell something by taking air in through the nose),probability of survival 생존 확률,"His mother's trunk intertwined with his and she said, ""Yes! We do have a keen sense of smell!"" 엄마의 코가 Chidi의 코와 엉키면서 엄마가 말했다. ""그래! 우리는 냄새를 정말로 잘 맡지!""",나는 늘 무당벌레는 그저 하루살이와 같은 곤충인 줄로만 생각했는데. I always thought ladybugs are just like any other insects like fruit flies.,That is unusual! 그거 정말 신기하네!,What kind of personalities do fish have? 물고기는 어떤 성격들을 갖고 있는데?,"Have you heard the fact that animals such as fish, rats, and lizards have personalities? 물고기, 쥐, 도마뱀과 같은 동물들이 성격을 갖고 있다는 사실을 들어본 적이 있니?","Well, I'm not sure about their height, but the length of their legs was similar to an average human adult! 음, 키는 정확히 모르는데, 하지만 다리의 길이는 평균 성인 키와 비슷했대!",Wow! 우와!,who는 Grandma Bisa를 설명하는 계속적 용법의 관계대명사로 생략할 수 없다.,"pesticide 농약, 살충제","Have you heard the saying, ""No man is an island""? '누구도 혼자 살아가는 사람은 없다'라는 말 들어봤니?",과거 완료 시제 [had+p.p.]로 경험을 나타낸다.,Give and take,It had affected his mom greatly for a long time. 그것은 오랫동안 그의 엄마에게 큰 영향을 끼쳤다.,It is true that dolphins display acts of kindness from time to time. 돌고래가 이따금 친절을 베푸는 것은 사실이죠,Don't you own a dog? 너도 강아지 있지 않니?,"Shy fish would take fewer risks, which would obviously enhance their survival rates in the ocean. 수줍은 물고기들이 위험을 덜 감수할 것이고, 이는 분명히 바다에서의 생존력을 높여주겠지.","It was deafening, with a real sense of urgency. 귀청이 터질 정도였고 긴박감이 느껴졌다.",enhance 높이다,from time to time 때때로,They are near. 그들이 가까이 있어.,what's more 게다가,"As he raised his trunk sniffing the fresh earthy air, he said, ""Oh! I know! Our trunks!"" 그가 코를 들어 올리며 신선한 대지의 공기를 킁킁거리면서 말했다. ""아! 알았어! 우리의 코예요""","roar 포효, 울부짖는 소리 (a loud deep cry)","pay tribute to ~를 추도하다, ~에게 경의를 표하다","Chidi thought to himself, ""If I knew how to freeze, I could help too."" Chidi는 속으로 생각했다. ""나도 ‘정지'하는 방법을 안다면 도움이 될 텐데.""",How tall were they? 키는 얼마나 컸다니?,That's all for today. 오늘은 여기까지입니다.,"After a few hours, the family stopped for rest and water. 몇 시간 후, 가족들은 휴식을 취하고 물을 마시려 멈췄다.",to be는 to부정사의 부사적 용법으 로 형용사 glad의 감정의 원인을 나타낸다.,감동적인 이야기로 우리 코너를 마무리하겠습니다. We will end our section with a touching story.,나도 나의 반려견에게서 많은 격려를 받는 것은 사실이야 It's true that I get a lot of encouragement from my dog as well.,집에 강아지를 들이는 것은 정말 큰 변화야. Welcoming a dog to your home is a big change.,adopt 입양하다,"Chidi was afraid for Fayola, but he felt immense relief when he heard her cry because he knew that she was safe. Chidi는 Fayola가 걱정되었지만, 그녀가 무사함을 알고 있었기 때문에 그녀의 울음소리를 듣고는 커다란 안도감을 느꼈다.","A hundred and twenty million years ago crocodiles used to walk with two legs, and the length of their legs was similar to an average human adult.","Chidi는 살면서 이렇게 큰 혼란을 본 적이 없었다. 그가 시끄러운 소리가 나는 쪽으로 고개를 돌렸을 때, 그는 여동생 Fayola가 강에서 허우적거리는 것을 보았다. Chidi had never seen so much chaos in his life - when he turned his head towards the roars, he saw his younger sister Fayola struggling in the river.",He spent an immense amount of time baking the cake.,fruit fly 초파리,The boy wants to adopt a puppy as a good friend.,"urgency 긴급, 위급 (the quality or state of being urgent)",무당벌레가 천부적인 농작물 보호자인지 몰랐어. I didn't know ladybugs are natural protectors of crops.,Some lizards are very social but some only interact with a small group of lizard friends. 어떤 도마뱀은 매우 사교적이지만 어떤 도마뱀은 소그룹에서만 교류한대.,Let's move on to another humanlike emotion. 사람과 비슷한 다른 감정으로 넘어갑시다.,콤마 뒤에 쓰인 which는 앞의 his heart-shaped ears를 선행사로 받는 계속적 용법의 관계대명사로 'and they'로 바꿔 쓸 수 있다.,"Oh, yes! 응!",The goalkeeper swiftly blocked the ball.,"""Chidi, if you don't want to be disturbed by birds, stay close to us!"" ""Chidi, 새들에게 방해받고 싶지 않으면 우리 곁에 붙어 있어라""",접속사 so that은 목적( 하기 위해)의 부사절을 이끌며 주로 조동사가 따라온다.,They're so adorable. 강아지는 너무 귀여워,"""Aunt Dalia!"" ""Dalia 이모!""",as는 접속사로 ~하면서로 해석한다. as 대신 while도 표현할 수 있다.,"Hm, yeah, that makes sense. 음, 일리가 있네.","그 애는 태어난 지 겨우 몇 달밖에 되지 않았고, Chidi는 그 애가 수영할 준비가 되어 있지 않다는 것을 알고 있었다. She was only a few months old, and Chidi knew that she wasn't ready to swim.","Well, (monkey sound) sounds like Titi monkeys also get jealous! 음, (원숭이 소리) 티티원숭이들도 질투하는 것 같네요!",height 키,"intertwine 뒤얽히다, 엮다 (to unite by twining one with another)","No, tell me more. 아니, 더 말해봐.","He vividly remembered a time when he was very young, when his little brother died as soon as he was born. 그는 아주 어렸을 때, 어린 동생이 태어나자마자 죽었던 때를 생생하게 기억했다.","As는 접속사로 '하는 동안에, ~하면서’라고 해석한다."
영어,고등학교,1학년,10공영1-01-02,말이나 글의 주제나 요지를 파악한다.,wireless communication 무선 통신,그렇다면 우리는 어디서 일을 하게 될까요? Then where are we humans going to work?,There are many areas hard to reach by road 거기엔 차로 가기가 힘든 곳이 많아.,"Next time, we'll talk more about the society of the future. 다음 시간에 미래 사회에 관해 더 얘기하겠습니다.",현재분사로 시작되는 분사구문,ness: happiness(행복),Thank you for listening. 들어 주셔서 감사합니다.,I've always thought space travel happens only in the movies. 나는 항상 우주여행은 영화에서만 가능한 거로 생각했는데,They are used by the military.,learn(ing) by trial and error 시행착오를 통해 학습하다,Everything from appliances to cars will be digitally connected. This will make it much 가전제품에서부터 자동차까지 모든 것이 디지털로 연결될 것입니 다.,Not anymore. 이제는 아니야.,"The more money David has, the less friends he has (David에게 돈이 더 많아질수록 친구는 줄었다.)",the more you understand. The more you know,"the+비교급, the+비교급",Have you ever watched the launch of the spaceship to the International Space Station? 너 국제 우주 정거장에 우주선을 발사하는 것 봤니?,좋아. Okay.,Not only physical works but also intellectual works such as healthcare and education will be done by Al robots. 육체적인 일뿐만 아니라 건 강관리와 교육과 같은 지적인 일도 인공지능 로봇이 하게 될 것입 니다.,"In other words, creativity and sensibility of humans will not be totally replaced by works of machines. These two will be 다시 말해서, 인간의 창 의성과 감성은 완전히 기계의 일로 대체될 수는 없을 것입니다.",기타 명사형 어미,It was really convenient. 정말 편했어.,ground-breaking 획기적인,surpass 능가하다,"Today, we are going to talk about features of our future society. 오늘은 미래사회의 특징에 관해 얘기하 도록 하겠습니다.",thus,"At the same time, most of jobs that are now being done by humans will be fully automated. That is, Al robots 동시에 사람들이 지금 하는 대부분 직업이 완전히 자동화가 될 것입니다.",come in handy,결론으로 자신의 의견을 다시 한번 명확하게 진술한다.,Outline,for example,What would they need drones for there? 드론이 거기서 왜 필요하지?,accurate a. 정확한,Changes in Our Future Society,"안녕하세요, 학생 여러분. Hello, students. 안녕하세요, 학생 여러분.",such as,그 로봇은 심지어 내 질문에 답도 하 고 내 좌석까지 안내도 해줬어.,"Yes, it was a ground-breaking moment. 그래, 획기적인 순간이었어.",분사구문,It sounds like sci-fi movies have become a reality. 공상과학 영화가 현실이 된 것 같아.,"turn out : 임이 드러나다, 증명되다",Where do you think drones can be widely used? 드론은 어디에 많이 쓰일까?,앞뒤 절의 구조와 어순을 맞추는 것에 유의한다.,주절과의 관계를 생각하여 알맞은 접 속사를 넣어 해석해준다.,That backpack will come in handy when you have a lot of things to carry!,Benjamin was very disappointed. Hearing his friends could not come to his party,It seems like just around the corner. 바로 코앞으로 다가왔어.,fluent a. 유창한,It sounds like human learning by trial and error. 시행착오를 통한 인간 학습처럼 들리네.,Yoga has had a great effect on my life. Yoga has had a great effect on my life.,the tighter he held onto his coat. The stronger the wind blew,Al robots learn from their mistakes and adjust their processes. 인공지능 로봇은 자신의 실수에서 배우고 그 과정을 수정해나가.,"맞아. 정말 그래 Yes, it does.","즉, 인공 지능 로봇이 그 일을 차지할 것입니다. That is, Al robots will take over the jobs.","For example, if self-driving cars are widely adopted, no more drivers will be needed.",Watch out!,the more nervous he becomes. The more he likes her,it is a matter of time 그것은 시간문제다,Can you explain more in detail? 자세히 설명 좀 해줄래?,"In my opinion, they are used in some remote places in Africa. 내 의견으로는, 아프리카의 몇몇 외진 지역에 쓰일 것 같아",sadness(슬픔),has more benefits(risks) than risks(benefits) has more benefits(risks) than risks(benefits),주절과의 관계를 생각하여 알맞은 접 속사를 넣어 주고 반드시 수동의 의미로 해석하도록 한다.,Drones deliver medical goods including blood and basic medicine to such areas. 드론은 그런 지역에 혈액이나 기본 의약품을 포함한 의료용품을 배달하지.,I'll see you next class. 다음 시간에 봅시다.,Really? 그래?,미래는 무선 통신과 인공지능이라는 두 가지로 말할 수 있습니다. The future can be explained in two phrases: Wireless communications and artificial intelligence.,remote place 외진 지역,Animal behaviors that are similar to humans',Al's quick and accurate processing can make it easier to track endangered animals and analyze their data.,Some people look at science fiction movies and think that AI will surpass humans in the end.,반대 의견을 진술+예시를 들어 준다. (생략 가능),"Since pets are family members who depend on us, we should be responsible and do the right thing. 반려동물들은 우리에게 의존하는 가족의 구성원이기 때문에, 우리는 책임을 지고 올바른 행동을 해야 한다",around the corner 코앞에 와 있는,이 두 가지가 미래에서는 더욱더 인정받을 것입니다. These two will be more appreciated in the future.,"Yes, it is a matter of time. How can AI robots act like humans? 어떻게 인공지능 로봇이 인간처럼 행동할까?",How should we survive in the future? 우리는 미래에 어떻게 살아남아야 할까요?,what's more : 더구나,reality 현실,I wonder what it feels like to go to space. 나는 우주로 간다는 것은 어떤 기분일지 궁금해.,I think that
영어,고등학교,1학년,10공영1-01-03,말이나 글의 분위기나 화자나 인물의 심정 및 의도 등을 추론한다.,The police needed details which could help identify the robber.,"Welcome to our beautiful igloo resort. Located in Finland, our resort offers you a special opportunity to experience unique beauties of Arctic environment.",As stated by,"Research shows that camping can have mental and physical health advantages, from getting better sleep to improving mood.",We offer many sleeping options from log cabins to glass igloos.,on average,Eating plant-based foods can reduce our carbon footprint.,"With increasing concerns about our environment and climate change, many people are pursuing a more sustainable lifestyle.","For those who enjoy outdoor activities, ice fishing and cross-country skiing in national parks are prepared.",Don't worry. 걱정하지 마.,Discover the true beauty of nature!,What is the problem which worries you most?,They are trying to escape the city's crowdedness and air pollution.,Make sure your room is free from any light or noise that might disturb your sleep.,Come and visit us for your wonderful once-in-a-lifetime experience.,"Also, we have five saunas where you can warm yourself and two wonderful restaurants where you can enjoy delicious food in Finland.","Another great example are the supertrees, which is 50 meter tall artificial trees in Gardens by the Bay.",It was great! 정말 좋았어요!,"If you do not get enough sleep, you will be very moody and irritable the next day.",It turns out that teens are not getting enough sleep.,It means you have every possibility open to you. 모든 가능성이 네게 열려 있다는 의미잖아.,핀란드에 있는 리조트를 홍보하려고,Isn't she the really positive girl from last year? 작년부터 참 긍정적인 아이라고 하지 않았니?,This is the book that I wanted to buy.,landfill,But that's what I like about new beginnings. 하지만 그게 내가 새로운 시작을 좋아하는 점이야.,Camping: a Healthy Trend,"Especially in the glass igloo, you will sleep under the Arctic sky watching the magical colors of an aurora from your bed.","These methods may look small, but I'm sure all the small changes add up to making a big difference if we all do small things!",compost 퇴비,method,Do you want to start practicing sustainable living? 지속 가능한 생활을 시작하고 싶습니끼?,"Although it does not mean the more you sleep, the healthier you will be, an adequate amount of sleep will help you concentrate better at school and keep you safe from catching a cold.","Although there are various methods, here are three quick and easy habits to live a sustainable life: go zero waste, save energy, and save water. 물론 다양한 방법이 있겠지만, 여기 지속 가능한 삶을 살기 위한 빠르고 쉬운 세 가지 습관이 있습니다.: 폐기물 제로화, 에너지 절약, 그리고 물 절약입니다.",according to: ~에 따르면,"If that's not possible, start with something easy: put your phone away.",domestic,"Briefly described, sustainable living means practicing a lifestyle that reduces your need of the natural resources for the future generations. 간단히 설명하면 지속 가능한 생활이란 미래 세대를 위해 여러분의 천연 자원의 필요성을 줄이는 생활방식을 실천하는 것을 의미합니다.",But do you know what a sustainable lifestyle is? 그런데 지속 가능한 생활방식이 무엇인지 알고 있나요?,I spent only one day next to her and she made me laugh so much today. 겨우 하루 그 애 옆에서 보냈는데 오늘 그애 때문에 얼마나 웃었는지 몰라요.,Is this the train that goes to Busan?,sharing 나눔,People who enjoy camping say that they can feel a sense of healing when they come out in nature.,I understand how you feel.,Yes. 맞아요.,Good luck!,How about you go up to people and start conversatioens?,I think we should do something to reduce the amount of plastic we use.,It is easier than you think. 생각보다 쉽습니다.,"Now, it is normal to find plants on the top, inside, and even the sides of buildings in Singapore.",I think this year will be awesome. 올해는 정말 멋질 것 같아요.,reusable: able to be used more than once,That's the book that is written by my uncle.,"I agree, but how can we do that?","I'm excited, but I'm also worried about making new friends. 나는 기대되지만, 친구 사귀기가 걱정이야.",Abby,reduce,Don't make comments that are not appropriate in this situation.,"These days, more and more people are taking an interest in outdoor activities such as camping.",in short: 간단히 말하면,implement,repair- mend,to be of the proper size and shape for,I saw the shoes that you bought last week on sale.,Your phone may ring or let out light that might disturb your sleep.,I know. 나도 알아.,You can bring your own cloth bags when you shop.,she made me laugh so much 그녀는 나를 많이 웃게 했다,"Even if you're not ready to totally eliminate meat or dairy, adopting a more plant-based diet does matter and does make a difference.",positive 긍정적인,I'm just worried because everything is so new. 그냥 모든 것이 새로워서 걱정돼.,applroximately,make friends 친구를 사귀다,It is easier than you think.,"It's not realistic to expect every single person to adopt a vegan diet overnight, though.","With increasing concerns about our environment and climate change, many people are pursuing a more sustainable lifestyle. 우리의 환경과 기후 변화에 대한 우려가 증가함에 따라 많은 사람이 좀 더 지속 가능한 생활방식을 추구하고 있습니다.",appliance,sustainable 지속 가능한 causing little or no damage to the environment and therefore able to continue for a long time,Are you getting enough sleep everyday?,eco-friendly
