subject,school,grade,code,content,text_1,text_2,text_3,text_4,text_5,text_6,text_7,text_8,text_9,text_10,text_11,text_12,text_13,text_14,text_15,text_16,text_17,text_18,text_19,text_20,text_21,text_22,text_23,text_24,text_25,text_26,text_27,text_28,text_29,text_30,text_31,text_32,text_33,text_34,text_35,text_36,text_37,text_38,text_39,text_40,text_41,text_42,text_43,text_44,text_45,text_46,text_47,text_48,text_49,text_50,text_51,text_52,text_53,text_54,text_55,text_56,text_57,text_58,text_59,text_60,text_61,text_62,text_63,text_64,text_65,text_66,text_67,text_68,text_69,text_70,text_71,text_72,text_73,text_74,text_75,text_76,text_77,text_78,text_79,text_80
영어,초등학교,4학년,4영04-03,실물이나 그림을 보고 쉽고 간단한 낱말이나 어구를 쓸 수 있다.,Water A liquid that puts out fires.,Work as a team,Helmet (헬멧),Let's learn and have fun!,F I R E F I G H T E R,Introduction to Firefighters:,Example Sentence: The firefighter puts on a helmet to protect his head.,Alarm (알람),__________,Example Sentence: Firefighters use water to stop the fire.,Fire Truck (소방차),Use these words to help you:,Safety (안전),Firefighter A person who puts out fires.,We can visit a fire station to see where firefighters work.,Fire truck (소방차),Water coming from the hose,Ladder A tool that helps firefighters reach high places.,Water cools the fire and makes it safe.,I see a fire truck.,"When there is a fire, they drive a big firetruck to the scene.",I see a fire hose.,They use water to put out the fire.,A firefighter is a person who helps to stop fires.,Fire truck (소방차),__________,Fire Hose (소방호스),Find the words related to firefighters in the word search below.,Firefighters save people and animals.,Look at the picture of a firefighter.,They drive fire trucks.,They climb a __________ to save people from high places.,They work hard to rescue people and save lives.,Helmet (헬멧),Look at the pictures of firefighters and their tools.,L A D D E R P,Rescue 구조하다,Example Sentence: The firefighter uses the hose to spray water on the fire.,Activity 3: Draw and Write,Write them down at home!,Example Sentence: Call 911 in an emergency.,Draw a picture of a firefighter in action.,"When there is an emergency, the alarm rings, and firefighters rush to help people.",Water can stop the fire from getting bigger.,Can you match the words to the pictures?,Firefighter (소방관),Fire Truck A big red truck with water and tools to fight fires.,Fire Helmet: Firefighters wear a helmet on their heads to stay safe.,Helmet A hard hat that firefighters wear for safety.,Firefighters work hard to help everyone stay safe!,Example Sentence: Fire is a danger to people's homes.,Use special tools,A firefighter is a brave person.,"If someone is stuck, the firefighter goes to rescue them.",The hose sprays water on the fire.,He wears a special uniform.,Firefighters use water to put out fires.,Look at the pictures of a firefighter and their tools.,A B C H O S E,Fire Hose A long tube that sprays water to put out fires.,Ladder 사다리,Unit: He is a Firefighter,The fire station has the fire truck and firefighters.,Brave Being strong and not afraid.,Sentence: The fire truck is red.,Helmet (헬멧),Learning Objective: Write simple words or phrases based on pictures or real objects.,Example Sentence: The firefighter uses the fire hose to stop the fire.,Fire Station (소방서),Today we are learning about firefighters!,Helmet 헬멧,It also has a long ladder and a hose.,Example Sentence: The firefighter wears a helmet for safety.,Emergency A serious situation that needs quick help.,Firefighter (소방관),Fire truck (소방차),Helmet A protective hat that firefighters wear on their heads.,Example Sentence: The fire truck has a loud siren.,Ladder (사다리),"When there is a fire, the firefighter comes quickly in a big fire truck."
영어,초등학교,5학년,6영01-01,"간단한 단어, 어구, 문장을 듣고 강세, 리듬, 억양을 식별한다.","(Answer: ""banana"" with a rhythm)","""Can you help me with my homework?"" (Rising intonation)","Example: ""Are you coming?""","Key stress: ""PLAYS"" – notice how we emphasize it!",What is Intonation?,"""I like to read books.""","""Can you help me with my homework?""","Key stress: ""LIKE"" – this word is important!",Good morning! 좋은 아침! Good 일상 대화처럼 상승 How are you? 어떻게 지내세요? How 부드럽게 상승 Thank you! 감사합니다! Thank 강하게 상승 See you later! 나중에 봐요! See 느리게 상승 What is your name? 당신의 이름은 무엇인가요? Name 서서히 상승,Hello 안녕하세요 He-llo Hé-llo 하이 Thank you 감사합니다 Than-k you Thánk you 감사해요 Goodbye 안녕히 가세요 Good-bye Góodbye 잘 가요 Can I help you? 도와드릴까요? Can I help you? Ca-n I help you 도와드릴게요?,It makes our speech sound musical.,(Answer: on stressed words),"For example, in ""banana,"" the stress is on the second syllable: baNAna.",Where does your voice get louder?,Remember to say the second part louder!,Stress means some syllables in words are louder or stronger than others.,"TAble (2 syllables: TA is strong, ble is weak)",It also makes our speaking sound more natural.,"For example, when you ask a question, your voice goes up at the end:",Hello! 안녕하세요! 첫 음절에 강세 ↑ 반가운 억양 How are you? 어떻게 지내세요? “How”에 강세 ↑ 궁금한 억양 I am fine. 저는 괜찮습니다. “fine”에 강세 → 평범한 억양 Thank you! 감사합니다! “Thank”에 강세 ↑ 기쁜 억양 See you later! 나중에 봐요! “See”에 강세 → 친근한 억양,"The word ""banana"" has stress on the second syllable: baNAna.",Listen to the following sentences.,Hello 안녕하세요 첫 음절에 강세 (First syllable stressed) 일정한 간격 (Even rhythm) 중간에서 높아짐 (Rises in the middle) I love you 나는 너를 사랑해 ‘love’에 강세 (Stress on 'love') 감정에 따라 변화 (Changes with emotion) 끝에서 떨어짐 (Falls at the end) What is your name? 너의 이름이 뭐니? ‘name’에 강세 (Stress on 'name') 질문이므로 상승 (Rises because it's a question) 마지막에서 높아짐 (Rises at the end) Thank you 고마워 ‘thank’에 강세 (Stress on 'thank') 부드럽게 흐름 (Smooth flow) 끝에서 떨어짐 (Falls at the end) Goodbye 안녕히 가세요 첫 음절에 강세 (First syllable stressed) 일정한 간격 (Even rhythm) 조금 떨어짐 (Slightly falls),"Understanding stress, rhythm, and intonation helps us communicate better.","""Are you coming to the party?"" (It goes up at the end.)",Pay attention to which words are stressed.,"""I love music!""",What is your name? What is YOUR name? WHA-tis your NAME? Rising at the end I like to play soccer. I LIKE to play SOCCER. I like to PLAY soCCER. Flat with a slight rise at the end Can you help me? Can you HELP me? CAN you HELP me? Rising at the end It is a sunny day. It is a SUNNY day. It is a SUNny DAY. Falling at the end I love chocolate. I LOVE chocolate. I LOVE choCOlate. Falling at the end,"Statement: ""I am going to the party."" (voice goes down)","Hello, how are you? He*llo, how a*re you? High-low-high Rising at the end What is your name? What is *your *name? Even rhythm Rising at the end I'm fine, thank you! I'm *fine, thank *you! High-low-high Falling at the end See you later! See *you *later! Quick rhythm Falling at the end What do you like? What do *you *like? Even rhythm Rising at the end",Practice making the stressed words louder.,"Rhythm: The pattern of sounds in speech, like music.","Example: ""I like ice cream."" (The rhythm goes up and down)",Hello 안녕 He-llo 쉬고 긴장감이 있는 느낌 상승 억양 (Upward intonation) Thank you 감사합니다 Thank-you 고르게 발음 평온한 억양 (Calm intonation) How are you? 어떻게 지내세요? How are you? 올라갔다가 내려가는 리듬 상승 후 하강 억양 (Rising then falling intonation) Goodbye 안녕히 가세요 Good-bye 확실한 발음 하강 억양 (Falling intonation) I'm happy 나는 행복해요 I'm hap-py 부드러운 리듬 상승 억양 (Upward intonation),Great job!,Intonation is the up and down pitch of your voice when you speak.,"Hello, my name is Peter. HEL-lo, my NAME is PE-ter. hello, MY name IS pe-TER. rising at the end. I like apples and bananas. I LIKE AP-ples and ba-NA-nas. I like APPLEs and BA-nanas. neutral tone. What time is it? WHAT time IS it? WHAT time is IT? rising intonation. It is a sunny day! It is A SUN-ny DAY! it IS a SUN-ny DAY! falling intonation. Can you help me? Can YOU HELP me? CAN you HELP me? rising intonation.","Happy /ˈhæpi/ 첫 음절에 강세 “Happy birthday” 음절을 나누어 말하기 올라가는 억양: “Are you happy?” Goodbye /ɡʊdˈbaɪ/ 두 번째 음절에 강세 “Goodbye”를 리듬에 맞춰 말하기 내려가는 억양: “Goodbye, see you later.” Welcome /ˈwɛlkəm/ 첫 음절에 강세 “Welcome home”을 노래처럼 말하기 올라가는 억양: “Welcome to the party!”","""We will have a picnic tomorrow.""","ToMAto (3 syllables: to is weak, MA is strong, to is weak)","In English, we use stress in words.",Intonation: The rise and fall of our voice when we speak.,Hello 안녕하세요 həˈloʊ First syllable (첫 음절) Even (고른 리듬) Rising (오르는 억양) Goodbye 안녕히 가세요 ɡʊdˈbaɪ Second syllable (두 번째 음절) Even (고른 리듬) Falling (내리는 억양) Thank you 감사합니다 ˈθæŋk jʊ First syllable (첫 음절) Even (고른 리듬) Rising (오르는 억양) How are you? 어떻게 지내세요? haʊ ɑːr juː Second syllable (두 번째 음절) Varied (다양한 리듬) Rising (오르는 억양) I love you 사랑해요 aɪ lʌv juː Second syllable (두 번째 음절) Even (고른 리듬) Falling (내리는 억양),"Apple 첫 음절 강세 (First syllable stressed) 중간 리듬 (Moderate rhythm) 상승억양 (Rising intonation) Hello, how are you? 상황에 따라 다름 (Depends on the situation) 부드러운 리듬 (Soft rhythm) 내려가는 억양 (Falling intonation) Thank you! 두 번째 음절 강세 (Second syllable stressed) 빠른 리듬 (Fast rhythm) 상승억양 (Rising intonation) What’s your name? 첫 음절 강세 (First syllable stressed) 일정한 리듬 (Steady rhythm) 내려가는 억양 (Falling intonation)","""I love to play soccer!""",This helps others understand what we mean better.,“Are you coming to the party?”,"""I'm fine, I'm fine, thank you!""","""Do you want to play?""","(Answer: ""apple"")",What is Stress?,"""It is a sunny day.""","When we ask a yes/no question, our voice goes up at the end.",dog big dog The dog is big. doG da-DUM ↑ cat small cat The cat is small. CAT da-DUM ↓ play let's play Let's play outside. PLAY da-DUM → read good book I read a good book. READ da-DUM ↑ happy very happy She is very happy. HAP-py da-DUM ↓,"<table border=""1""> <tr> <th>단어/구문 (Word/Phrase)</th> <th>강세 (Stress)</th> <th>리듬 (Rhythm)</th> <th>억양 (Intonation)</th> </tr> <tr> <td>Hello</td> <td>첫 번째 음절에 강세</td> <td>짝수이며 일정한 리듬</td> <td>오르락내리락</td> </tr> <tr> <td>Good morning</td> <td>두 번째 음절에 강세</td> <td>부드러운 리듬</td> <td>높이 변화</td> </tr> <tr> <td>How are you?</td> <td>“are”에 강세</td> <td>자유로운 리듬</td> <td>질문할 때 상승</td> </tr> <tr> <td>Thank you</td> <td>“Thank”에 강세</td> <td>비트가 일정</td> <td>친절하게 상승</td> </tr> <tr> <td>What’s your name?</td> <td>“name”에 강세</td> <td>댄스 리듬</td> <td>질문할 때 상승</td> </tr> <tr> <td>See you later</td> <td>“later”에 강세</td> <td>규칙적인 리듬</td> <td>내리막</td> </tr></table>","In pairs, read a list of sentences aloud.","""I like to play soccer.""",Practice clapping along with your classmates!,"""I have a dog and his name is Max.""","""What time is it?"" (Make your voice go up at the end)","""The CAT is sleeping.""",Hello 안녕하세요 1 (강세가 있는 첫 음절) 가벼운 리듬 오르내리는 억양 I like apples. 나는 사과를 좋아해요. 1 (apples 강조) 부드러운 리듬 높아졌다가 낮아짐 Can you help me? 도와줄 수 있어요? 2 (help 강조) 딱딱한 리듬 질문 형태의 억양 What is your name? 이름이 뭐예요? 1 (name 강조) 부드러운 리듬 오르락 내리락 억양 Thank you! 감사합니다! 1 (you 강조) 짧은 리듬 높은 억양,"Hello! 안녕하세요! 첫 번째 음절에 강세가 있습니다. How are you? 어떻게 지내세요? ""How""에 강세가 있으며, 자연스러운 억양을 사용합니다. I love pizza! 나는 피자를 사랑해! ""love""에 강세가 있습니다. 감정을 담아 말합니다. What's your name? 이름이 뭐예요? 문장 끝에서 음이 상승합니다. Thank you! 고마워요! 첫 음절에 강세가 있으며, 따뜻한 억양을 사용합니다.","How does ""banana"" sound when you say it fast?","""Hello, hello, how are you?""","Say the question ""Is it sunny today?"" with a rising voice at the end.","(emphasize ""LIKE"")","(emphasize ""HAPPY"")","""Are you coming to the party?"" (Rising intonation)","""It is a sunny day."" (flat)",Rhythm is the pattern of sounds in English.,"Example: ""I am coming.""",Rhythm is the pattern of sounds and silences in speech.,Hello /həˈloʊ/ 두 번째 음절이 강조된다. 평범한 리듬 상승 Good Morning /ɡʊd ˈmɔrnɪŋ/ 두 번째 음절이 강조된다. 부드러운 리듬 상승 What is your name? /wɑt ɪz jər neɪm?/ 첫 번째 단어가 강조된다. 자연스러운 리듬 상승 후 하강 I like ice cream. /aɪ laɪk aɪs krim/ 'like'에 강조 부드러운 리듬 상승 Let's go to the park. /lɛts ɡoʊ tə ðə pɑrk/ 'go'에 강조 활기찬 리듬 상승 후 하강,"""I had a great time!"" (It goes down at the end.)","When we speak English, some parts of words and sentences are louder or longer.","""She has a big dog.""",Listening Exercise: Listen to a partner say these words.,"Students will be able to identify stress, rhythm,","For example, in the word ""banana,"" the second syllable is stressed: baNAna."
영어,초등학교,5학년,6영01-02,"간단한 단어, 어구, 문장을 강세, 리듬, 억양에 맞게 소리 내어 읽는다.","Keep delivering the sentence to S4 with a motion. S4, come to the front of the classroom and write the sentence on the board. Then","Good morning, everyone!","I'll ask, ""What will you do during winter vacation?"" after hiding the sentences. Stand up and answer my question",I like to make robots,"S1, ask me, ""What will you do during winter vacation?""",I want to be a fashion designer,I like to make robots.,I want to be a photographer.,What do you want to be?,I like to take pictures.,I want to be a chef.,Take turns in a group and repeat the activity. The group that gets the most points wins.,question in the textbook while you are listening to your friends. Are there any volunteers who want to read what they wrote?,I will join a ski camp.,I want to be a fashion designer. I like to design clothes.,Who do you think will spend their vacation in the most meaningful way?,"Dolphins, dolphins.",it face down and put your head down again. Repeat the activity in the same way for all members of your group.,I'll show you six sentence cards on the board.,brush,"First, let's listen to the text and read it silently.",Right. Read the sentence aloud.,Whose,I want to be a scientist.,Make groups of six and decide the player order.,"Photographer, dolphins.",What do you want to be?,musician,"Photographer, photographer.",Stick them on the tree for New Year's plans.,I will go to Africa,Let's check the answers. What did you write for number 1?,I want to be a soccer player.,Which word did you put in the blank?,Have a good day!,"I will read science books,","섭 바무어 주도록 안내한다. I'll write down a sentence on the board. If the sentence is correct, read Lesson 12 표과서 180 181쪽 the sentence aloud. If not, clap your hands once. (칠판에 'I will join a ski",Good. What did you write for number 2?,What will you do in the future?,"I'll show you a sentence without a word. Guess the missing word and complete the sentence. Then, write it in your notebook. (교사가 'I will",I want to be a soccer player.,It's sunny.,The group that writes the correct sentence and reads it correctly gets one point.,What will you do during winter vacation?,What do you want to be?,What will you do today?,"Please read aloud ""Jane Goodall"" once more at home.","sentences in Scene 1. Group 2, read the sentences in Scene 2. Read the scenes in order as they match your group numbers.",right,What do you want to be?,one point. Take turns and repeat the activity. The group that gets the most points wins.,camera,straight,Great.,What are your New Year's plans?,left,Then S1 explains the sentence using motions but no words.,Make groups of six and decide the player order. Prepare a set of picture cards.,I will visit many museums.,I like to play soccer.,Right. What did you write for number 3?,I want to be a police officer.,help people,I like to help people.,Make groups of four and stand in a line looking backward except for S1.,your,I want to be a chef.,English,The group in which all members answer correctly gets one point. Take turns and repeat the activity. The group,"/f/, photographer",umbrella,"Group leaders, come to the front with your members' Post-It notes.",go,Look at the pictures. What do you see?,"Make groups of four and decide the player order. Then, put your head down on the desk.",umbrella,"Then, write it in your notebook.",What do you want to be?,this,I like to play soccer.
영어,초등학교,5학년,6영01-03,"간단한 단어, 어구, 문장의 의미를 이해한다.",Make groups of six. I'll write the club and the motion of each grade on the board. Walk around the classroom with the motion of the first grade and get together with a classmate. Play rock-paper-scissors.,"Then, make a dialog with your partner.","When I say ""One, two, three!"", choose one of the places and go there.",Listen to the dialog again and answer the questions in the textbook.,"Now, let's all share together.","Everyone, repeat after me.",Listen and put up as many fingers as the grade.,Do you want some more?,"Let's read ""Iane Goodall"" one more time.",Canada,animals. / I will take care of David. / I will be your mother and friend.,"Each of you, stand up one by one and say, for example, ""I'm in the sixth grade"" in the order of the cards on the board. If you stand up alone and say the sentence correctly, you get one point.","Let's sing the song ""What Grade Are You In?"" If the lyrics match my card, make an $O$ with your fingers, if not, make an $\times$.",Go straight one block and turn right.,Look at the large picture.,I will play the violin.,"Research a great person who you like. Imagine yourself as the man / woman and talk to your partner using the expression ""I will ..."", for example ""I will paint Mona Lisa.""",Can you guess what they are doing?,Let's watch the video clip and listen to the dialog.,I want to be a police officer.,"Now, switch roles and read the sentences.",You can use the clubs in your school.,Let's check the answers. What did you write for the first blank?,Go straight one block and turn right at the post office. it's on your left.,Choose a flag as your destination and place a marker at the starting point.,I watch TV at 6 and I go to bed at 9:30.,"겨울 방학을 앞둔 학생들의 방학 계획에 관련한 이미지로 스키캠프에 참여한 아이들과, 박물관을 다니는 아이들의 모습과, 여러 박물관들의 모습이 있는 이미지 입니다.",Can you share your dialog? Any volunteers?,Let's watch the video clip and listen to the dialog.,help people,"After finishing, compare the answers with your partner.",She is tall and she has long curly hair.,Make groups of three.,China,He has short straight hair and big eyes.,"Also, we'll learn the /gr/ sound.",건물들이 있는 그림이다.,Let's watch the video clips and listen carefully.,Work in pairs. Put a textbook in the middle of the desk.,Listen to the dialog again and answer the questions in the textbook.,Go down the ladder and circle the right word to match with the picture.,It's next to the market.,"상단에는 붓 이미지가 있고 하단에는 총 10칸에 h,i,r,q,r,k,b,a,p,s의 알파벳들을 사용해 붓을 의미하는 영어 단어를 추론하는 시각 자료이다.",Walk around the classroom and play rock-paper-scissors.,Please try some.,It's delicious.,I like to play soccer.,우체국을 찾기 위한 지도이다.,I'll put the grade cards and lucky cards in a box.,"The loser asks the winner what grade he /she is in and what club he/she is in. If the winner answers correctly, he / she can move up to the second grade.",Listen to the dialog and follow the way to reach the correct grade.,My friend and her son are waiting for us.,"Play rock-paper-scissors with your partner. If you win with rock, go one step toward your flag. If you win with scissors, go two steps. With paper, go three steps.",건물과 길이 그려져 있는 마을 지도 이다.,Whose brush was it?,"중앙에 도로가 있고, 양쪽의 도로들 사이로 건물과 공원이 있습니다.<br> 가장 위의 좌측에는 건물 2개와 '자리 ①'이 있고, 가장 위의 우측에는 건물 3개가 있습니다.<br> 중앙의 좌측에는 공원과 '자리 ②'가 있고, 중앙의 우측에는 '자리 ③'과 건물 2개가 있습니다.<br> 가장 아래의 좌측에는 건물 1개와 조경, '자리 ④'가 있고, 가장 아래의 우측에는 '자리 ⑤'와 건물 2개가 있습니다.",Pick two cards from the box and keep them a secret.,Let's watch the video clip and listen to the key expressions.,Please practice the dialog with your friends or family.,salty,let's learn the words and phrases.,"The second graders do the second grade's motion, meet the same grade, and repeat the activity. The group that has the most sixth graders wins.",Look at the small picture.,I get up at 6 and I go to school at 8:40.,let's change some words with other grades and clubs.,I want to be a scientist.,"Look at ""Let's Learn"" and check what we will learn in this lesson.",Find and underline the expressions about grades.,"do the same thing, raise your hand. I'll read science books during winter vacation.","again and repeat them aloud, keeping the intonation of each sentence in mind.",What did Emily and Jitae find on the floor?,"If the number of thumbs up in your group is the same as the grade I said, your group gets one point.","Today, we're going to read and write expressions about asking and answering about grades and clubs.",I will take care of David.,Research a great person who you like.,Look at the keywords in this lesson on page 8. Listen to the words and repeat them.,I like to cook.,What floor has Jitae and Emily's club been changed to?,"Let's read ""Come to Our Club"" one more time and solve the problem in the textbook.",Go straight two blocks and turn right at the market. Go straight two blocks and turn right at the market.
영어,초등학교,5학년,6영01-04,일상생활 주제에 관한 담화나 글의 세부 정보를 파악한다.,Sujeonggwa is a Korean drink.,크기가 작습니다.,It's time for bed.,"Oh! No, thanks.",You can make a new name for your pizza.,It's delicious.,Do you have any foods to add?,This is the menu.,다양한 맛이 있습니다.,You can come to my house at 4: 30.,"Wow, whose dog is this?",It's spicy and sweet.,It's sweet.,My favorite subject is P.E.,I get home at 4 .,painter,"피자에는 레몬, 고구마. 김치, 베이컨이 있습니다.","A hamburger and milk, please.",Where is it from?,It's sweet.,It's cake.,"Oh, it's time for school.",I do my homework at 5:30.,I get up at 6.,"It's my dog, Toto.",Please tell me about your day.,Sit down.,It's delicious.,My favorite season is summer.,Bye.,Help yourself.,What time do you go to bed?,"If you could make a new pizza, what kinds of tastes do you want it to have?","Great! Now, write down some ingredients and tastes of the pizza in the mind map in your textbook.",What time do you have lunch?,This is a 4 in 1 pizza.,Please help yourself.,"Nice to meet you, too.",art,I like it very much.,They have many colors.,My favorite subject is science.,Do you want some more?,It has many flavors.,Italy.,맵기도 하고 단맛도 납니다.,"Try some spaghetti, Emily.","Oh, I'm late. See you later.",마카롱은 프랑스 쿠키입니다.,What time do you do your homework?,젤라토는 이탈리아 아이스크립입니다.,It's 9 .,Good morning.,It's sour.,What time do you have lunch?,You can drink it with tteok.,Come here. Toto.,Can you guess what the toppings are on the pizza?,What time do you get up?,"Oh, I have math homework.",Macarons are French cookies.,This is my uncle.,My favorite musician is Beethoven.,I get home at 4.,I like the dive shows!,Welcome to Mr. Robot's Restaurant.,Come and see my dog.,"Yes, I do.",Are they big?,What's the name of this pizza?,What does the boy like?,I can see snow.,"Oh! Yes, please.","Oh, I have dance class at 5:30.",What time do you do your homework?,I come here at 8 and check on the fish.,One year old.,Omija tea.,It's chicken.,맛있거든요.
