subject,school,grade,code,content,text_1,text_2,text_3,text_4,text_5,text_6,text_7,text_8,text_9,text_10,text_11,text_12,text_13,text_14,text_15,text_16,text_17,text_18,text_19,text_20,text_21,text_22,text_23,text_24,text_25,text_26,text_27,text_28,text_29,text_30,text_31,text_32,text_33,text_34,text_35,text_36,text_37,text_38,text_39,text_40,text_41,text_42,text_43,text_44,text_45,text_46,text_47,text_48,text_49,text_50,text_51,text_52,text_53,text_54,text_55,text_56,text_57,text_58,text_59,text_60,text_61,text_62,text_63,text_64,text_65,text_66,text_67,text_68,text_69,text_70,text_71,text_72,text_73,text_74,text_75,text_76,text_77,text_78,text_79,text_80
영어,고등학교,1학년,10영03-04,친숙한 일반적 주제에 관한 글을 읽고 필자의 의도나 글의 목적을 파악할 수 있다.,"They can express our feelings and emotions, influence our mood, and even affect our decisions.",Let me share some of these colorful aspects of my life.,Even a short trip to a nearby town can offer new experiences and adventures.,How can hobbies help reduce stress according to the text?,"Living a colorful life means experiencing different emotions, activities, and relationships that make us who we are.",I also enjoy various hobbies that help me express myself.,"Finally, creative expression plays a key role in bringing color to our lives.",Joining a club or a group with similar interests can encourage friendships and shared experiences.,"In summary, engaging in hobbies is not just about passing the time; it plays a vital role in enhancing our wellbeing and happiness.",Friendship is one of the most vibrant colors in the painting of life.,What does the author suggest about the importance of having hobbies in our lives?,A simple phone call or a smile from a loved one can change our day.,My friends add excitement to my life.,But what exactly makes our lives colorful?,Reading Passage: The Importance of Hobbies,"Similarly, a musician can communicate feelings through melodies that words cannot describe.",Even a short trip to a nearby town can offer new experiences and adventures.,Let’s explore some important elements that can enhance our daily experiences.,"In our busy lives, we often forget the importance of doing things that make us happy.",The green trees and colorful flowers in my neighborhood create a beautiful environment that makes me feel alive.,Taking a short walk outside can help you feel more connected to nature and bring a sense of peace to your mind.,"In this text, I want to share how everyday moments can brighten our lives.","When we spend time doing things we love, we feel more fulfilled and happy.",They provide a break from our routines and allow us to explore our interests.,"In this passage, I will explore some important elements that can make life vibrant and enjoyable.",How does personal growth contribute to a vibrant life?,Can you think of a piece of art that uses color effectively?,Travel and New Experiences,Each element brings a unique brightness to our experiences.,Why are friendships considered important in creating a colorful life?,Traveling to new places is like adding exciting new shades to our life’s canvas.,Friends and family make our lives richer.,"For example, a painter can express their emotions through colors and brush strokes.",One of the main reasons why hobbies are important is that they help reduce stress.,Traveling to new places is another way I add color to my life.,The colors of nature remind me that every day is a new beginning.,"For example, I often wear blue because it calms me and makes me feel confident.",Moments like these feel like they paint my memories with bright colors.,Hobbies are activities we do for fun and enjoyment in our free time.,How do colors in nature affect your mood?,Each new experience teaches us something valuable and adds a new shade of color to our lives.,"Trying new things, whether it's a new language, a cooking class, or even a new sport, can be incredibly fulfilling.",Hobbies are activities we do for enjoyment during our free time.,"By dedicating time to something we love, we can recharge our minds and bodies.","So, the next time you see a beautiful sunset or a bright flower, take a moment to appreciate the colors that make life so wonderful.",Many people find that having a hobby helps them relax and reduce stress.,"For me, the most vibrant colors come from the people I love, the places I visit, and the hobbies I enjoy.","Friends bring joy, support, and laughter into our lives.","Last summer, I visited the coast.",Everyone has different experiences that make their lives colorful.,The people around me bring joy and warmth.,What does the author suggest about the importance of having hobbies in our lives?,"Spending time with loved ones can bring joy, comfort, and laughter.",Painting is one of my favorites.,Why is it important to have a balance between work and relaxation?,Friendship,"In this text, we will explore some common factors that contribute to a colorful life.",What are some examples of hobbies mentioned in the passage?,"By focusing on these areas, we can paint our lives with vibrant colors that reflect our true selves.","Life can seem dull at times, but there are many ways to add color to our daily experiences.","In our busy lives, we often forget to take time for ourselves.","Whether it's painting, playing a musical instrument, or playing sports, having a passion keeps us motivated and excited.",One of the most significant factors in adding color to our lives is our relationships with family and friends.,"The blue ocean, golden sand, and the bright sun created a beautiful scene.","By answering these questions, you will be able to understand the author’s intention and the main purpose of this text.","Lastly, personal growth plays a crucial role in adding color to our lives.",Engaging in hobbies is another way to add color to life.,One of the most important aspects of a colorful life is the relationships we build.,"When we pursue activities we are passionate about, we often meet people who share similar interests.","In conclusion, life is colorful because of the relationships we build, the places we explore, and the passions we pursue.","Moreover, hobbies can also connect us with others.","Additionally, hobbies can help us meet new people and build friendships.","Whether it’s alone or with others, spending time on what we love can make our lives more colorful.",Hobbies play a vital role in adding joy and excitement to our daily lives.,"When I paint, I can express my feelings and thoughts through colors.",They provide an escape from our daily routines and help us explore our creativity.,Unit Title: What Makes Your Life Colorful?,"We often spend weekends together, playing games, or cooking.",They are there to celebrate our achievements and help us through difficult times.,Every day is an opportunity to experience something beautiful.
영어,고등학교,1학년,10영03-06,친숙한 일반적 주제에 관한 글을 읽고 함축적 의미를 추론할 수 있다.,"Moreover, hobbies can help us connect with others.",Colors are everywhere in our lives.,Introduction:,"While one person finds happiness in nature, another might enjoy creativity through art or sports.",Constantly learning new things can keep your life interesting.,"These connections often remind us that we are not alone, and that support and love can be found all around us.",Colors can also represent different emotions and ideas.,Why does the author believe that a colorful life is not only about physical colors?,"On the other hand, the color blue can represent calmness.","For instance, if you love photography, you might join a photography club.",Why is it important to pursue hobbies and passions?,Where was it?,"For instance, my visit to Jeju Island was like stepping into a painting.",This can lead to lasting friendships and a sense of belonging.,Family and Friends: My family is my primary source of happiness.,"When you think of a fun day at the beach, you might remember the bright blue ocean and the golden sand.","This way, you can meet new friends who share your passion!","For example, think about the last time you spent time with your family.",Each color represents different emotions and experiences that contribute to our happiness.,Hobbies are activities that we enjoy doing in our free time.,One of the most beautiful aspects of life is the power of connection.,"These daily experiences may seem ordinary, but they add color and joy to our lives.","Engaging in a hobby can bring color to our everyday routine, making life more enjoyable and fulfilling.",They bring us happiness and help us relax.,"Traveling to new places can open your eyes to different cultures, foods, and experiences.",Let's explore some of the things that can add color to our lives.,"We share laughter, support each other, and create unforgettable memories together.","Each choice adds a layer of meaning to your life, making it more colorful.","Whether it’s painting, playing a musical instrument, or playing sports, activities that you love can make you feel fulfilled and happy.",How do connections with others enhance our daily experiences?,"They are activities that we enjoy doing in our free time, and they help us express ourselves and connect with others.","Moreover, hobbies can help us meet new people.","It’s the color of love and excitement, but it can also symbolize anger and strength.","When we share experiences with others, we create memories that brighten our days.",Experiencing new environments can inspire you and give you stories to tell.,"What are your hobbies, and how do they make your life colorful?",Describe it.,"When you see a field of sunflowers or a bright sun, you might feel cheerful and energized.","Some may enjoy creating art, such as painting or drawing, while others may prefer activities like playing sports or reading books.",What colors do you choose when expressing yourself?,"Some enjoy painting, while others might like playing sports or reading books.","How do different experiences ""color"" your life?",Hobbies play a vital role in our lives.,"On the other hand, red often represents passion and energy.",What does the author suggest we do when we feel that life is dull?,Activities such as hiking or simply taking a walk in the park can connect you with the earth and provide a sense of peace.,Have you ever noticed how certain colors make you feel?,"By understanding how these colors represent our emotions, we can learn to appreciate the beautiful palette that makes up our lives.",Another way to add color to life is through hobbies and passions.,Feel free to use this passage and questions to guide your understanding of how to derive meaning from familiar topics!,"It can be very relaxing, helping them forget about daily stress.","Reading can take us on adventures, introducing us to new worlds and ideas.","These moments might seem ordinary, but they are special.",What makes your life colorful?,"As you go through your day, try to pay attention to the colors you see and how they affect your mood.",The people we surround ourselves with play a huge role in our happiness.,"On the other hand, playing sports not only keeps us healthy but also teaches us teamwork and discipline.",Many people join clubs or groups that focus on their interests.,These moments can be anything from enjoying a cup of coffee in the morning to sharing a laugh with a friend.,Make a list of activities or people that bring you joy.,Colors also play an important role in different cultures.,"They help us develop skills, relieve stress, and create connections with others.",They remind us to appreciate the simple things around us.,"For instance, think about the color blue.",Think about your own life.,Building strong relationships can significantly enhance the color in our lives.,These experiences add vibrant colors to your life.,"The clothes you wear, the art you create, and even the food you eat can reflect the colors that resonate with you.","We explore new cafes, attend concerts, and simply enjoy each other’s company.",What did the author learn from traveling to Jeju Island?,"In addition to family time, hobbies also play an important role in making our lives colorful.",Each trip brings new experiences and knowledge.,What hobbies make your life more colorful?,"When we take time to do what we enjoy, we can create moments that light up our days.","Have you ever noticed how memories can also be ""colored""?","Whether it's picking up a new skill or studying a new subject, the process of learning can be both enriching and rewarding.","I learned about different cultures, tried new foods, and made friends from various backgrounds.",Growth brings excitement and a sense of achievement.,"In this lesson, we will explore how different colors can make our lives more colorful and meaningful.","So, next time you feel that life is dull, look around you."
영어,고등학교,1학년,10영04-01,일상생활이나 친숙한 일반적 주제에 관하여 듣거나 읽고 세부 정보를 기록할 수 있다.,Make phone calls and send text messages.,"Then, share your notes with a partner and discuss how smartphones affect your daily life.",I do feel tired sometimes.,Social Media Websites and applications that enable users to create and share content or to participate in social networking.,"Smart homes can save energy and provide security.""","Social media platforms, like Facebook and Instagram, have changed how we connect with friends and family.","With just a tap on the screen, we can send messages, make video calls, and share photos instantly.",They allow us to share our lives and communicate instantly.,Smart security systems that notify homeowners of unusual activity.,Take notes on the key points mentioned in the clip.,"However, overusing smartphones can lead to problems such as poor sleep quality and reduced facetoface interactions.",This makes it easy to relax after a long day.,"However, there are some downsides to using smartphones.","Therefore, it is important to use smartphones responsibly.",How can you find a balance between phone usage and other activities?,This easy access to information helps us stay informed and educated.,Most people cannot imagine a day without their smartphones.,Mia: Maybe.,Jake: I think I spend around six hours.,"It can also be distracting, making it harder to concentrate on our studies or work.""",Smartphones are one of the most significant advancements in technology.,Smartphones have changed our lives in many ways.,"In this lesson, we will explore some popular new technologies and their impacts on our daily lives.",Smartphones are used by millions of people around the world.,"First, they allow for easy communication.",Entertainment: Smartphones are also great sources of entertainment.,How do you usually use your smartphone?,Social media apps like Instagram and Facebook let us connect with others and share our experiences.,"We can make phone calls, send text messages, and use various apps to communicate instantly.",Listen to a short audio clip about the benefits and drawbacks of smartphones.,Access the internet for information and communication.,"However, it’s crucial to use them wisely and maintain a healthy balance in our interactions, both online and in person.",Instant sharing of photos and videos,Voiceactivated assistants that help with daily tasks.,"Access to Information: With smartphones, we have access to the internet at our fingertips.",Have you faced any challenges because of smartphone usage?,"Whether we want to check the news, search for information, or learn something new, everything is just a click away.",Write down at least three details you learned from the text about the benefits and challenges of smartphones.,Learning: Smartphones offer various educational apps that help students with their studies.,"Smartphones have greatly impacted our lives, making it easier to connect with others and access information.",This ability to access information can improve our learning experience.,Take notes on key points mentioned in the clip.,Some features of smart homes include:,This technology allows homeowners to control their appliances remotely.,(Teacher reads the following text aloud),Read the following paragraph and take notes on the main points.,"Many people spend too much time on their phones, leading to less facetoface interaction with others.","They also provide us with access to the internet, where we can find information about almost anything.","We can search for information on any topic, from school assignments to the latest news.",Communication The act of sharing information and ideas with others.,New technologies continue to evolve and impact our lives in many ways.,"With a smartphone, information is just a few taps away.","In this lesson, we explored how smartphones influence our daily lives.",Smartphone A mobile phone that includes advanced features and functions like a computer.,Too much screen time can lead to health issues like eye strain and lack of sleep.,"In pairs, discuss your own experiences with smartphones.",Use various applications that can help with everything from managing our schedules to tracking our fitness.,It is important to find a balance between using technology and spending time with family and friends.,"We can search for news articles, watch educational videos, or use apps to learn new skills.","Then, we will read an article that discusses how smartphones affect our daily activities.","However, we must use smartphones wisely.",Smartphones have become an essential part of our everyday life.,Need to look up a word or find out about a historical event?,"We can watch movies, play games, or listen to music whenever we want.","""Smartphones are powerful devices that allow us to stay connected with friends and family.",There are countless educational apps and resources available that can help with studying and completing homework.,Poor sleep quality,How can smartphones enhance your learning experience?,How do they help you in your daily life?,Positive Impacts of Smartphones:,Understanding these technologies can help us make the most of them while being aware of their effects on our daily routines.,"With just a few taps, we can send messages, make calls, and share photos.",What are two benefits of using smartphones mentioned in the passages?,This instant connection is very beneficial.,"Mia: Hey Jake, how many hours do you spend on your smartphone each day?",Smartphones have become an essential part of our daily lives.,Why is it important to balance smartphone time with other activities?,(Assigned reading material),They provide easy access to information.,"After listening to the passage and reading the article, please answer the following questions in your notebook:"
영어,고등학교,1학년,10영04-02,일상생활이나 친숙한 일반적 주제에 관하여 듣거나 읽고 간단하게 요약할 수 있다.,This has made it easier for us to stay connected.,"They help us communicate, stay organized, and improve our living environments.","For example, you can use a calendar app to keep track of homework assignments or upcoming events.","In conclusion, smartphones have greatly impacted our daily lives by improving communication, providing information, and aiding in organization.","In today's world, smartphones have become an essential part of our daily lives.","Additionally, smartphones help us find directions when we are traveling and allow us to check the weather.",This is helpful for doing research for school assignments or staying updated with the latest news.,"To sum up, smartphones are useful tools that help us in many aspects of our daily lives, but we should be careful not to rely on them too much.",It is important to find a balance in using this technology.,"Also, we can use various applications (apps) to listen to music, watch videos, or even play games.","Most teens communicate via text and social media, and many also use their phones for schoolrelated research.","We can monitor our physical activities, check our heart rate, and even manage our diet.","Almost everyone uses a smartphone for various tasks, from communication to entertainment.","However, they can lead to addiction and negatively affect our health when used excessively.",Identify the main points:,"They allow us to stay connected with friends and family, access information quickly, and entertain ourselves with games and videos.","We can send messages, make phone calls, and video chat instantly.","This makes traveling easier, whether we are going to a new place or navigating through our city.","Since smart devices collect personal data, there is a risk that this information could be accessed by hackers.","However, too much use can distract us from studying and harm our health.",Listen to the audio and write a short summary (34 sentences) about the impact of smartphones on our lives.,"Encourage students to practice summarizing the audio and reading material, focusing on the main ideas and key details!","We can send text messages, make calls, and even video chat with friends and family, no matter where they are in the world.","Many people spend too much time on their devices, which can lead to less facetoface interaction.",Many students find it hard to focus on their studies because they are tempted to check their notifications or play games.,Finding a balance between using technology and enjoying reallife experiences is important.,It’s essential to use smartphones wisely to enjoy their benefits without facing negative effects.,Another important aspect is entertainment.,Connected To be joined or linked together.,Benefits of smartphones,Write a short paragraph summarizing your thoughts.,Smartwatches enable us to monitor our health by tracking our heart rate and steps.,"After listening, discuss your thoughts with a partner and summarize the key points.",Cyberbullying Bullying that takes place over digital devices.,"They offer a variety of functions, allowing us to communicate, access information, and stay connected with friends and family.",Title: The Impact of Smartphones on Daily Life,It is important to be mindful of how we use smartphones to maintain a balance in our lives.,"Many teenagers use smartphones to stay in touch with friends, study, and have fun.",They provide us with tools to manage our schedules and set reminders.,"In summary, smartphones play a significant role in helping us in our daily lives but can also create challenges.",A recent survey showed that 85% of teens use their phones to communicate with friends through text messages and social media.,Let’s summarize some of the key points about how smartphones affect our everyday activities.,One negative effect is that they can distract us from focusing on work or studies.,"With various applications, we can plan our tasks, read books, and even learn new languages.","Additionally, excessive screen time can impact our health, both physically and mentally.","However, some experts warn that excessive use can lead to distractions, affecting school performance.","Many people feel they cannot live without their devices, leading to addiction and reduced facetoface interactions.",Discuss with your classmates how smartphones have changed the way you communicate.,Write down three advantages and three disadvantages mentioned in the clip.,"If we have a question, we can use the internet to find answers immediately.","Firstly, smartphones help us communicate easily.",Communication: Smartphones allow us to stay connected with friends and family no matter where we are.,Smartphones have become an essential part of our lives.,"While smartphones offer many benefits, too much screen time can be a distraction.","In recent years, many people have started using smartphones for almost everything.",Unit: New Technologies,This helps us in our studies and daily decisionmaking.,Downside A disadvantage or negative aspect.,This makes it easier to manage their time effectively.,"Secondly, smartphones provide access to information.","After reading the passage, write a short summary of what you learned about smartphones.",They provide quick access to information and entertainment.,Many teenagers use smartphones for various purposes.,"Thus, while social media has its benefits, it is important to use it carefully.",Access The means of approaching or entering a place.,It is important for users to find a balance between using smartphones and being present in real life.,"Entertainment: Smartphones offer various forms of entertainment, such as games, music, and videos.","On one hand, smartphones help us communicate easily through calls, texts, and social media apps.","Smartphones allow us to send messages, make calls, and access the internet anywhere we go.","As technology continues to evolve, we should be mindful of how we use these tools in our daily lives.","However, their impact on our daily routines is both positive and negative.",Smartphones help us communicate easily and provide access to information.,Smartphones are important tools that help us communicate and organize our lives.,"People use smartphones to communicate, access information, and even manage their daily tasks.",Write a short summary of the reading passage in your own words.,Listen to the audio or read the text carefully.,"Most people own a smartphone, and they use it for various purposes.","For example, people can turn on their lights, adjust the temperature, and even unlock their doors using their smartphones.",Navigation: Smartphones come with GPS technology that helps us find directions.,"With the internet at our fingertips, we can search for any information quickly."
